<?xml version="1.0" encoding="UTF-8"?>
<bc:levelSet xmlns:bc="http://www.example.org/level" xmlns:xsi="http://www.w3.org/2001/XMLSchema-instance" xsi:schemaLocation="http://www.example.org/level level.xsd ">
  <bc:links>
  	<bc:link id="1" name="bricksheet" type="image">simpleSprites.png</bc:link>
  	<bc:link name="Sphere3" type="jar">bc:link</bc:link>
  </bc:links>
  <bc:spriteSheets>
  	<bc:spritesheet id="2" name="ballSheet">
  		<bc:sprite>
  			<bc:x>0</bc:x>
  			<bc:y>0</bc:y>
  			<bc:width>127</bc:width>
  			<bc:height>127</bc:height>
  		</bc:sprite>
  		<bc:sprite>
  			<bc:x>128</bc:x>
  			<bc:y>0</bc:y>
  			<bc:width>127</bc:width>
  			<bc:height>127</bc:height>
  		</bc:sprite>
  	</bc:spritesheet></bc:spriteSheets><bc:levels>
  	<bc:meta>bc:meta</bc:meta>
  	<bc:specialDefs>
  		<bc:objectDef>
  			<bc:className>dissapearingBrick</bc:className>
  			<bc:numArgs>3</bc:numArgs>
  			<bc:x>0</bc:x>
  			<bc:y>0</bc:y>
  			<bc:argument type="int">
  				<bc:data>50</bc:data>
  			</bc:argument>
  			<bc:argument type="">
  				<bc:data>bc:data</bc:data>
  			</bc:argument>
  		</bc:objectDef>
  	</bc:specialDefs>
  	<bc:objects>
  		<bc:object class="Sphere" spritesheet_id="2">
  			<bc:x>0</bc:x>
  			<bc:y>0
  				0
  			</bc:y>
  			<bc:genericArgument type="int" bc:name="radius">
  				<bc:data>10</bc:data>
  			</bc:genericArgument>
  			<bc:genericArgument type="int" bc:name="mass">
  				<bc:data>100</bc:data>
  			</bc:genericArgument>
  		</bc:object>
  	</bc:objects>
  	<bc:triggers />
</bc:levels>
</bc:levelSet>
